[
  {
    "_id": {
      "$oid": "68a0ca3e4ffed6f853202099"
    },
    "__v": 0,
    "cook_time": 10,
    "cuisine": [
      "Arabic",
      "Middle Eastern",
      "Moroccan"
    ],
    "cuisine_type": "Middle Eastern",
    "description": "Recipe video above. The smell when this is cooking is outrageous! The marinade is very quick to prepare and the chicken can be frozen in the marinade, then defrosted prior to cooking. Best cooked on the outdoor grill / BBQ, but I usually make it on the stove. Serve with Yogurt Sauce (provided) or the Tahini sauce in this recipe. Add a simple salad and flatbread laid out on a large platter, then let everyone make their own wraps!",
    "dietary_tags": [
      "Gluten-Free",
      "Dairy-Free"
    ],
    "difficulty": "Easy",
    "image_url": "https://www.recipetineats.com/tachyon/2022/02/Chicken-Shawarma-Wrap_2-SQ.jpg",
    "import_metadata": {
      "confidence_score": 0.95,
      "extracted_at": "2023-10-01T12:00:00Z",
      "notes": "Scraped from recipe site.",
      "scraper_name": "RecipeScraper",
      "scraper_version": "1.0.0",
      "source_url": "https://www.recipetineats.com/chicken-sharwama-middle-eastern/"
    },
    "ingredients": [
      {
        "amount": "1",
        "name": "chicken thigh fillets",
        "unit": "kg"
      },
      {
        "amount": "1",
        "name": "large garlic clove",
        "unit": ""
      },
      {
        "amount": "1",
        "name": "ground coriander",
        "unit": "tbsp"
      },
      {
        "amount": "1",
        "name": "ground cumin",
        "unit": "tbsp"
      },
      {
        "amount": "1",
        "name": "ground cardamon",
        "unit": "tbsp"
      },
      {
        "amount": "1",
        "name": "ground cayenne pepper",
        "unit": "tsp"
      },
      {
        "amount": "2",
        "name": "smoked paprika",
        "unit": "tsp"
      },
      {
        "amount": "2",
        "name": "salt",
        "unit": "tsp"
      },
      {
        "amount": "1",
        "name": "black pepper",
        "unit": ""
      },
      {
        "amount": "2",
        "name": "lemon juice",
        "unit": "tbsp"
      },
      {
        "amount": "3",
        "name": "olive oil",
        "unit": "tbsp"
      },
      {
        "amount": "1",
        "name": "Greek yoghurt",
        "unit": "cup"
      },
      {
        "amount": "1",
        "name": "garlic clove",
        "unit": ""
      },
      {
        "amount": "1",
        "name": "cumin",
        "unit": "tsp"
      },
      {
        "amount": "1",
        "name": "lemon juice",
        "unit": "squeeze"
      },
      {
        "amount": "1",
        "name": "salt and pepper",
        "unit": ""
      },
      {
        "amount": "4",
        "name": "flatbreads",
        "unit": ""
      },
      {
        "amount": "1",
        "name": "sliced lettuce",
        "unit": ""
      },
      {
        "amount": "1",
        "name": "tomato slices",
        "unit": ""
      },
      {
        "amount": "1",
        "name": "red onion",
        "unit": ""
      },
      {
        "amount": "1",
        "name": "shredded cheese",
        "unit": "(optional)"
      },
      {
        "amount": "1",
        "name": "hot sauce",
        "unit": "(optional)"
      }
    ],
    "instructions": [
      {
        "step": 1,
        "description": "Marinade chicken - Combine the marinade ingredients in a large ziplock bag. Add the chicken, seal, the massage from the outside with your hands to make sure each piece is coated. Marinate 24 hours (minimum 3 hours)."
      },
      {
        "step": 2,
        "description": "Yogurt Sauce - Combine the Yogurt Sauce ingredients in a bowl and mix. Cover and put in the fridge until required (it will last for 3 days in the fridge)."
      },
      {
        "step": 3,
        "description": "Preheat stove or BBQ - Heat a large non-stick skillet with 1 tablespoon over medium high heat, or lightly brush a BBQ hotplate/grills with oil and heat to medium high. (See notes for baking)"
      },
      {
        "step": 4,
        "description": "Cook chicken - Place chicken in the skillet or on the grill and cook the first side for 4 to 5 minutes until nicely charred. Turn and cook the other side for 3 to 4 minutes (the 2nd side takes less time)."
      },
      {
        "step": 5,
        "description": "Rest - Remove chicken from the grill and cover loosely with foil. Set aside to rest for 5 minutes."
      },
      {
        "step": 6,
        "description": "To Serve"
      }
    ],
    "isActive": true,
    "likes": 0,
    "nutrition": {
      "calories": 500,
      "carbs": 30,
      "fat": 20,
      "fiber": 5,
      "protein": 40,
      "sugar": 5
    },
    "prep_time": 10,
    "servings": 4,
    "tags": [
      "Chicken Shawarma",
      "shawarma"
    ],
    "title": "Chicken Shawarma (Middle Eastern)"
  },
  {
    "_id": {
      "$oid": "68a0ca474ffed6f85320209a"
    },
    "__v": 0,
    "cook_time": 10,
    "cuisine": [
      "Vietnamese"
    ],
    "cuisine_type": "Asian",
    "description": "Recipe video above. An exciting way to use ground meat (mince) to make a quick stir fry that taste unbelievable! This is great made with chicken, turkey or pork. It also works with beef though it is better made with \"white meats\". Serve it over rice or vermicelli noodles to make rice bowls with shredded lettuce, carrots and cucumbers on the side (very classic Vietnamese meal!).**NOTE: If you reduce sugar then the pork will not caramelise as well and it will take longer to get colour on it!**",
    "dietary_tags": [
      "Gluten-free",
      "High-protein"
    ],
    "difficulty": "Easy",
    "image_url": "https://www.recipetineats.com/tachyon/2015/11/Vietnamese-Ground-Pork-Bowls_7.jpg",
    "import_metadata": {
      "confidence_score": 0.95,
      "extracted_at": "2023-10-01T12:00:00Z",
      "notes": "Recipe scraped from a popular cooking website.",
      "scraper_name": "RecipeScraper",
      "scraper_version": "1.0.0",
      "source_url": "https://www.recipetineats.com/vietnamese-caramelised-pork-bowls/"
    },
    "ingredients": [
      {
        "amount": "1 1/2",
        "name": "cooking oil",
        "unit": "tbsp"
      },
      {
        "amount": "1/2",
        "name": "onion",
        "unit": "cup"
      },
      {
        "amount": "2",
        "name": "ginger",
        "unit": "tsp"
      },
      {
        "amount": "2",
        "name": "garlic cloves",
        "unit": "cloves"
      },
      {
        "amount": "1",
        "name": "birds eye or Thai chili",
        "unit": "piece"
      },
      {
        "amount": "500",
        "name": "pork mince",
        "unit": "g"
      },
      {
        "amount": "5",
        "name": "brown sugar",
        "unit": "tbsp"
      },
      {
        "amount": "2",
        "name": "fish sauce",
        "unit": "tbsp"
      },
      {
        "amount": "1",
        "name": "green onion stem",
        "unit": "piece"
      },
      {
        "amount": "1",
        "name": "Jasmine rice",
        "unit": "cup"
      },
      {
        "amount": "1",
        "name": "Sliced red chilli, tomato, cucumber",
        "unit": "optional"
      }
    ],
    "instructions": [
      {
        "step": 1,
        "description": "Heat the oil in a large skillet over high heat."
      },
      {
        "step": 2,
        "description": "Saut\u00e9 - Add the onion, ginger, garlic and chili and cook for 2 minutes."
      },
      {
        "step": 3,
        "description": "Cook pork - Add the pork mince and cook for 2 minutes or so until white all over, breaking up the meat with a wooden spoon."
      },
      {
        "step": 4,
        "description": "Add sauce & caramelise - Add the sugar and fish sauce. Stir, then leave it to cook without touching until all the juices cook out and the pork starts caramelised - about 2 minutes. Then stir it and leave it again, without stirring, for around 30 seconds to get more caramelisation. Repeat twice more until caramelised to your taste."
      },
      {
        "step": 5,
        "description": "Serve over jasmine or other rice, or vermicelli noodles, garnished with sliced green onion. For a low carb, low cal option, try Cauliflower Rice! I like to have chunks of plain cucumber and carrots on the side which is a classic way of making Vietnamese bowls."
      }
    ],
    "isActive": true,
    "likes": 0,
    "nutrition": {
      "calories": 450,
      "carbs": 30,
      "fat": 20,
      "fiber": 5,
      "protein": 35,
      "sugar": 15
    },
    "prep_time": 10,
    "servings": 4,
    "tags": [
      "Ground pork recipe",
      "ground pork stir fry",
      "Pork mince recipe",
      "pork mince stir fry"
    ],
    "title": "Vietnamese Caramelised Pork Bowls"
  },
  {
    "_id": {
      "$oid": "68a0ca5c4ffed6f85320209b"
    },
    "__v": 0,
    "cook_time": 45,
    "cuisine": [
      "Latin American"
    ],
    "cuisine_type": "Latin American",
    "description": "Our tender Peruvian-style grilled chicken is slow-cooked with a vinegar and spice rub. But it's the sauce that everyone loves, and it's easy to make with cilantro, jalape\u00f1os, and aj\u00ed amarillo peppers.",
    "dietary_tags": [
      "low carb"
    ],
    "difficulty": "medium",
    "image_url": "https://www.seriouseats.com/thmb/C3krJOJUOnhLCXe3KqnxtjbeUCk=/1500x0/filters:no_upscale():max_bytes(150000):strip_icc()/20210629-peruvian-style-grilled-chicken-melissa-hom-seriouseats-hero-4fce2b49df81448aa16437362819162f.jpg",
    "import_metadata": {
      "confidence_score": 0.95,
      "extracted_at": "2023-10-01T12:00:00Z",
      "notes": "Recipe scraped from Serious Eats.",
      "scraper_name": "RecipeScraper",
      "scraper_version": "1.0.0",
      "source_url": "https://www.seriouseats.com/peruvian-style-grilled-chicken-with-green-sauce-recipe"
    },
    "ingredients": [
      {
        "amount": "3",
        "name": "jalape\u00f1o chiles, roughly chopped",